"locationid","Applicant","FacilityType","cnn","LocationDescription","Address","blocklot","block","lot","permit","Status","FoodItems","X","Y","Latitude","Longitude","Schedule","dayshours","NOISent","Approved","Received","PriorPermit","ExpirationDate","Location","Fire Prevention Districts","Police Districts","Supervisor Districts","Zip Codes","Neighborhoods (old)","DayOrder","DayOfWeekStr","starttime","endtime","PermitLocation","locationdesc","optionaltext","scheduleid","start24","end24","Addr_Date_Create","Addr_Date_Modified","ColdTruck"
"System.Collections.ObjectModel.Collection`1[System.Management.Automation.PSObject]","System.Collections.ObjectModel.Collection`1[System.Management.Automation.PSObject]","Push Cart","System.Collections.ObjectModel.Collection`1[System.Management.Automation.PSObject]","STOCKTON ST: 04TH ST \ ELLIS ST \ MARKET ST intersection","800 MARKET ST","0329001","System.Collections.ObjectModel.Collection`1[System.Management.Automation.PSObject]","System.Collections.ObjectModel.Collection`1[System.Management.Automation.PSObject]","21MFF-00129","APPROVED","Soft pretzels: hot dogs: sausages: chips: popcorn: sodea: coffee: espresso: cappucino: pastries: ice cream: Italian sausages: shish-ka-bob: churros: juice: water: various drinks.","System.Collections.ObjectModel.Collection`1[System.Management.Automation.PSObject]","System.Collections.ObjectModel.Collection`1[System.Management.Automation.PSObject]","System.Collections.ObjectModel.Collection`1[System.Management.Automation.PSObject]","System.Collections.ObjectModel.Collection`1[System.Management.Automation.PSObject]","http://bsm.sfdpw.org/PermitsTracker/reports/report.aspx?title=schedule&report=rptSchedule&params=permit=21MFF-00129&ExportPDF=1&Filename=21MFF-00129_schedule.pdf","","","12/23/2021 12:00:00 AM","20211203","1","11/15/2022 12:00:00 AM","System.Collections.ObjectModel.Collection`1[System.Management.Automation.PSObject]","14","10","10","28852","6","0","Sunday","6AM","9PM","800 MARKET ST","Located on Market St at the corner or Ellis/Stockton St intersection","Soft pretzels, hot dogs, sausages, chips, popcorn, sodea, coffee, espresso, cappucino, pastries, ice cream, Italian sausages, shish-ka-bob, churros, juice, water, various drinks.","","06:00","21:00","03/10/2011 12:14:43 PM","11/21/2011 04:59:06 PM","N"
"System.Collections.ObjectModel.Collection`1[System.Management.Automation.PSObject]","System.Collections.ObjectModel.Collection`1[System.Management.Automation.PSObject]","Push Cart","System.Collections.ObjectModel.Collection`1[System.Management.Automation.PSObject]","STOCKTON ST: OFARRELL ST to GEARY ST (100 - 199)","101 STOCKTON ST","0314002","System.Collections.ObjectModel.Collection`1[System.Management.Automation.PSObject]","System.Collections.ObjectModel.Collection`1[System.Management.Automation.PSObject]","21MFF-00131","APPROVED","Soft Pretzels: hot dogs: sausage: chips: popcorn: soda: espresso: cappucino: pastries: ice cream: italian sausages: shish-ka-bob: churros: juice: water: various drinks","System.Collections.ObjectModel.Collection`1[System.Management.Automation.PSObject]","System.Collections.ObjectModel.Collection`1[System.Management.Automation.PSObject]","System.Collections.ObjectModel.Collection`1[System.Management.Automation.PSObject]","System.Collections.ObjectModel.Collection`1[System.Management.Automation.PSObject]","http://bsm.sfdpw.org/PermitsTracker/reports/report.aspx?title=schedule&report=rptSchedule&params=permit=21MFF-00131&ExportPDF=1&Filename=21MFF-00131_schedule.pdf","","","12/23/2021 12:00:00 AM","20211203","1","11/15/2022 12:00:00 AM","System.Collections.ObjectModel.Collection`1[System.Management.Automation.PSObject]","5","10","10","28852","6","0","Sunday","6AM","9PM","101 STOCKTON ST","Push cart located at the NW corner of Stockton St & OFarrell St, on Stockton St.","Soft Pretzels, hot dogs, sausage, chips, popcorn, soda, espresso, cappucino, pastries, ice cream, italian sausages, shish-ka-bob, churros, juice, water, various drinks","","06:00","21:00","11/21/2011 05:03:19 PM","11/21/2011 05:03:35 PM","N"
"System.Collections.ObjectModel.Collection`1[System.Management.Automation.PSObject]","System.Collections.ObjectModel.Collection`1[System.Management.Automation.PSObject]","Push Cart","System.Collections.ObjectModel.Collection`1[System.Management.Automation.PSObject]","MARKET ST: 04TH ST \ ELLIS ST \ STOCKTON ST to POWELL ST (800 - 890) -- NORTH --","870 MARKET ST","0329005","System.Collections.ObjectModel.Collection`1[System.Management.Automation.PSObject]","System.Collections.ObjectModel.Collection`1[System.Management.Automation.PSObject]","21MFF-00130","APPROVED","Soft pretzels: hot dogs: sausages: chips: popcorn: soda: espresso: cappucino: pastry: ica cream: ices: italian sausage: shish-ka-bob: churros: juice: water: various drinks","System.Collections.ObjectModel.Collection`1[System.Management.Automation.PSObject]","System.Collections.ObjectModel.Collection`1[System.Management.Automation.PSObject]","System.Collections.ObjectModel.Collection`1[System.Management.Automation.PSObject]","System.Collections.ObjectModel.Collection`1[System.Management.Automation.PSObject]","http://bsm.sfdpw.org/PermitsTracker/reports/report.aspx?title=schedule&report=rptSchedule&params=permit=21MFF-00130&ExportPDF=1&Filename=21MFF-00130_schedule.pdf","","","12/23/2021 12:00:00 AM","20211203","1","11/15/2022 12:00:00 AM","System.Collections.ObjectModel.Collection`1[System.Management.Automation.PSObject]","14","10","10","28852","6","0","Sunday","6AM","9PM","870 MARKET ST","Push cart located at the cable car turn around, adjacent to the queue line approximately 20' West from the entrance of the 890 Market St building.","Soft pretzels, hot dogs, sausages, chips, popcorn, soda, espresso, cappucino, pastry, ica cream, ices, italian sausage, shish-ka-bob, churros, juice, water, various drinks","","06:00","21:00","12/14/2011 02:58:53 PM","12/14/2011 02:59:21 PM","N"
"System.Collections.ObjectModel.Collection`1[System.Management.Automation.PSObject]","System.Collections.ObjectModel.Collection`1[System.Management.Automation.PSObject]","Truck","System.Collections.ObjectModel.Collection`1[System.Management.Automation.PSObject]","SUTTER ST: POWELL ST to MASON ST (500 - 599)","556 SUTTER ST","0284009","System.Collections.ObjectModel.Collection`1[System.Management.Automation.PSObject]","System.Collections.ObjectModel.Collection`1[System.Management.Automation.PSObject]","22MFF-00001","APPROVED","Hot coffee: iced coffee: hot chocolate: tea: pastries","System.Collections.ObjectModel.Collection`1[System.Management.Automation.PSObject]","System.Collections.ObjectModel.Collection`1[System.Management.Automation.PSObject]","System.Collections.ObjectModel.Collection`1[System.Management.Automation.PSObject]","System.Collections.ObjectModel.Collection`1[System.Management.Automation.PSObject]","http://bsm.sfdpw.org/PermitsTracker/reports/report.aspx?title=schedule&report=rptSchedule&params=permit=22MFF-00001&ExportPDF=1&Filename=22MFF-00001_schedule.pdf","","","01/13/2022 12:00:00 AM","20220113","0","11/15/2022 12:00:00 AM","System.Collections.ObjectModel.Collection`1[System.Management.Automation.PSObject]","5","1","10","28857","21","0","Sunday","6AM","8PM","15 MARINA BLVD","On South Side of Marina Blvd. approximately 205' from Laguna St. Intersection","Hot coffee, iced coffee, hot chocolate, tea, pastries","","06:00","20:00","12/23/2014 08:24:05 AM","12/23/2014 08:24:35 AM","N"
"System.Collections.ObjectModel.Collection`1[System.Management.Automation.PSObject]","System.Collections.ObjectModel.Collection`1[System.Management.Automation.PSObject]","Truck","System.Collections.ObjectModel.Collection`1[System.Management.Automation.PSObject]","CALIFORNIA ST: SANSOME ST to LEIDESDORFF ST (400 - 448)","401 CALIFORNIA ST","0260001","System.Collections.ObjectModel.Collection`1[System.Management.Automation.PSObject]","System.Collections.ObjectModel.Collection`1[System.Management.Automation.PSObject]","22MFF-00001","APPROVED","Hot coffee: iced coffee: hot chocolate: tea: pastries","System.Collections.ObjectModel.Collection`1[System.Management.Automation.PSObject]","System.Collections.ObjectModel.Collection`1[System.Management.Automation.PSObject]","System.Collections.ObjectModel.Collection`1[System.Management.Automation.PSObject]","System.Collections.ObjectModel.Collection`1[System.Management.Automation.PSObject]","http://bsm.sfdpw.org/PermitsTracker/reports/report.aspx?title=schedule&report=rptSchedule&params=permit=22MFF-00001&ExportPDF=1&Filename=22MFF-00001_schedule.pdf","","","01/13/2022 12:00:00 AM","20220113","0","11/15/2022 12:00:00 AM","System.Collections.ObjectModel.Collection`1[System.Management.Automation.PSObject]","4","1","10","28854","6","0","Sunday","6AM","8PM","15 MARINA BLVD","On South Side of Marina Blvd. approximately 205' from Laguna St. Intersection","Hot coffee, iced coffee, hot chocolate, tea, pastries","","06:00","20:00","12/23/2014 08:24:05 AM","12/23/2014 08:24:35 AM","N"
"System.Collections.ObjectModel.Collection`1[System.Management.Automation.PSObject]","System.Collections.ObjectModel.Collection`1[System.Management.Automation.PSObject]","Truck","System.Collections.ObjectModel.Collection`1[System.Management.Automation.PSObject]","MONTGOMERY ST: COLUMBUS AVE \ WASHINGTON ST to JACKSON ST (700 - 799)","735 MONTGOMERY ST","0195001","System.Collections.ObjectModel.Collection`1[System.Management.Automation.PSObject]","System.Collections.ObjectModel.Collection`1[System.Management.Automation.PSObject]","22MFF-00001","APPROVED","Hot coffee: iced coffee: hot chocolate: tea: pastries","System.Collections.ObjectModel.Collection`1[System.Management.Automation.PSObject]","System.Collections.ObjectModel.Collection`1[System.Management.Automation.PSObject]","System.Collections.ObjectModel.Collection`1[System.Management.Automation.PSObject]","System.Collections.ObjectModel.Collection`1[System.Management.Automation.PSObject]","http://bsm.sfdpw.org/PermitsTracker/reports/report.aspx?title=schedule&report=rptSchedule&params=permit=22MFF-00001&ExportPDF=1&Filename=22MFF-00001_schedule.pdf","","","01/13/2022 12:00:00 AM","20220113","0","11/15/2022 12:00:00 AM","System.Collections.ObjectModel.Collection`1[System.Management.Automation.PSObject]","3","1","10","28860","4","0","Sunday","6AM","8PM","15 MARINA BLVD","On South Side of Marina Blvd. approximately 205' from Laguna St. Intersection","Hot coffee, iced coffee, hot chocolate, tea, pastries","","06:00","20:00","12/23/2014 08:24:05 AM","12/23/2014 08:24:35 AM","N"
"System.Collections.ObjectModel.Collection`1[System.Management.Automation.PSObject]","System.Collections.ObjectModel.Collection`1[System.Management.Automation.PSObject]","Truck","System.Collections.ObjectModel.Collection`1[System.Management.Automation.PSObject]","PINE ST: BATTERY ST to SANSOME ST (200 - 299)","250 PINE ST","0261007","System.Collections.ObjectModel.Collection`1[System.Management.Automation.PSObject]","System.Collections.ObjectModel.Collection`1[System.Management.Automation.PSObject]","22MFF-00001","APPROVED","Hot coffee: iced coffee: hot chocolate: tea: pastries","System.Collections.ObjectModel.Collection`1[System.Management.Automation.PSObject]","System.Collections.ObjectModel.Collection`1[System.Management.Automation.PSObject]","System.Collections.ObjectModel.Collection`1[System.Management.Automation.PSObject]","System.Collections.ObjectModel.Collection`1[System.Management.Automation.PSObject]","http://bsm.sfdpw.org/PermitsTracker/reports/report.aspx?title=schedule&report=rptSchedule&params=permit=22MFF-00001&ExportPDF=1&Filename=22MFF-00001_schedule.pdf","","","01/13/2022 12:00:00 AM","20220113","0","11/15/2022 12:00:00 AM","System.Collections.ObjectModel.Collection`1[System.Management.Automation.PSObject]","4","1","10","28854","6","0","Sunday","6AM","8PM","15 MARINA BLVD","On South Side of Marina Blvd. approximately 205' from Laguna St. Intersection","Hot coffee, iced coffee, hot chocolate, tea, pastries","","06:00","20:00","12/23/2014 08:24:05 AM","12/23/2014 08:24:35 AM","N"
"System.Collections.ObjectModel.Collection`1[System.Management.Automation.PSObject]","System.Collections.ObjectModel.Collection`1[System.Management.Automation.PSObject]","Truck","System.Collections.ObjectModel.Collection`1[System.Management.Automation.PSObject]","MARINA BLVD: LAGUNA ST to BEACH ST \ BUCHANAN ST \ LOWER FORT MASON ST (1 - 99)","15 MARINA BLVD","0446002","System.Collections.ObjectModel.Collection`1[System.Management.Automation.PSObject]","System.Collections.ObjectModel.Collection`1[System.Management.Automation.PSObject]","22MFF-00001","APPROVED","Hot coffee: iced coffee: hot chocolate: tea: pastries","System.Collections.ObjectModel.Collection`1[System.Management.Automation.PSObject]","System.Collections.ObjectModel.Collection`1[System.Management.Automation.PSObject]","System.Collections.ObjectModel.Collection`1[System.Management.Automation.PSObject]","System.Collections.ObjectModel.Collection`1[System.Management.Automation.PSObject]","http://bsm.sfdpw.org/PermitsTracker/reports/report.aspx?title=schedule&report=rptSchedule&params=permit=22MFF-00001&ExportPDF=1&Filename=22MFF-00001_schedule.pdf","","","01/13/2022 12:00:00 AM","20220113","0","11/15/2022 12:00:00 AM","System.Collections.ObjectModel.Collection`1[System.Management.Automation.PSObject]","13","9","1","57","17","0","Sunday","6AM","8PM","15 MARINA BLVD","On South Side of Marina Blvd. approximately 205' from Laguna St. Intersection","Hot coffee, iced coffee, hot chocolate, tea, pastries","","06:00","20:00","12/23/2014 08:24:05 AM","12/23/2014 08:24:35 AM","N"
"System.Collections.ObjectModel.Collection`1[System.Management.Automation.PSObject]","System.Collections.ObjectModel.Collection`1[System.Management.Automation.PSObject]","Push Cart","System.Collections.ObjectModel.Collection`1[System.Management.Automation.PSObject]","POST ST: KEARNY ST to ROBERT KIRK LN (100 - 140)","100 POST ST","0294004","System.Collections.ObjectModel.Collection`1[System.Management.Automation.PSObject]","System.Collections.ObjectModel.Collection`1[System.Management.Automation.PSObject]","21MFF-00147","APPROVED","Hot dogs: condiments: soft pretzels: soft drinks: coffee: cold beverages: pastries: bakery goods: cookies: ice cream: candy: soups: churros: chestnuts: nuts: fresh fruit: fruit juices: desserts: potato chips and popcorn.","System.Collections.ObjectModel.Collection`1[System.Management.Automation.PSObject]","System.Collections.ObjectModel.Collection`1[System.Management.Automation.PSObject]","System.Collections.ObjectModel.Collection`1[System.Management.Automation.PSObject]","System.Collections.ObjectModel.Collection`1[System.Management.Automation.PSObject]","http://bsm.sfdpw.org/PermitsTracker/reports/report.aspx?title=schedule&report=rptSchedule&params=permit=21MFF-00147&ExportPDF=1&Filename=21MFF-00147_schedule.pdf","","","12/17/2021 12:00:00 AM","20211217","1","11/15/2022 12:00:00 AM","System.Collections.ObjectModel.Collection`1[System.Management.Automation.PSObject]","5","1","10","28857","6","0","Sunday","6AM","12AM","100 POST ST","Corner of Post and Kearny, on Post","Hot dogs, condiments, soft pretzels, soft drinks, coffee, cold beverages, pastries, bakery goods, cookies, ice cream, candy, soups, churros, chestnuts, nuts, fresh fruit, fruit juices, desserts, potato chips and popcorn.","","06:00","23:59","09/06/2011 12:42:52 PM","09/06/2011 12:50:21 PM","N"
"System.Collections.ObjectModel.Collection`1[System.Management.Automation.PSObject]","System.Collections.ObjectModel.Collection`1[System.Management.Automation.PSObject]","Push Cart","System.Collections.ObjectModel.Collection`1[System.Management.Automation.PSObject]","NEW MONTGOMERY ST: MARKET ST \ MONTGOMERY ST intersection","2 MONTGOMERY ST","0291007","System.Collections.ObjectModel.Collection`1[System.Management.Automation.PSObject]","System.Collections.ObjectModel.Collection`1[System.Management.Automation.PSObject]","21MFF-00143","APPROVED","Hot dogs: condiments: soft pretzels: soft drinks: coffee: cold beverages: pastries: bakery goods: cookies: ice cream: candy: soups: churros: chestnuts: nuts: fresh fruit: fruit juices: desserts: potato chips and popcorn.","System.Collections.ObjectModel.Collection`1[System.Management.Automation.PSObject]","System.Collections.ObjectModel.Collection`1[System.Management.Automation.PSObject]","System.Collections.ObjectModel.Collection`1[System.Management.Automation.PSObject]","System.Collections.ObjectModel.Collection`1[System.Management.Automation.PSObject]","http://bsm.sfdpw.org/PermitsTracker/reports/report.aspx?title=schedule&report=rptSchedule&params=permit=21MFF-00143&ExportPDF=1&Filename=21MFF-00143_schedule.pdf","","","12/17/2021 12:00:00 AM","20211217","1","11/15/2022 12:00:00 AM","System.Collections.ObjectModel.Collection`1[System.Management.Automation.PSObject]","4","1","10","28854","6","0","Sunday","6AM","12AM","2 MONTGOMERY ST","Northeast Corner of Market & Montgomery St, on Market","Hot dogs, condiments, soft pretzels, soft drinks, coffee, cold beverages, pastries, bakery goods, cookies, ice cream, candy, soups, churros, chestnuts, nuts, fresh fruit, fruit juices, desserts, potato chips and popcorn.","","06:00","23:59","09/06/2011 11:07:31 AM","09/06/2011 11:07:46 AM","N"
"System.Collections.ObjectModel.Collection`1[System.Management.Automation.PSObject]","System.Collections.ObjectModel.Collection`1[System.Management.Automation.PSObject]","Push Cart","System.Collections.ObjectModel.Collection`1[System.Management.Automation.PSObject]","HOWARD ST: 03RD ST to 04TH ST (700 - 799)","701 HOWARD ST","3734091","System.Collections.ObjectModel.Collection`1[System.Management.Automation.PSObject]","System.Collections.ObjectModel.Collection`1[System.Management.Automation.PSObject]","21MFF-00145","APPROVED","Hot dogs: condiments: soft pretzels: soft drinks: coffee: cold beverages: pastries: bakery goods: cookies: ice cream: candy: soups: churros: chestnuts: nuts: fresh fruit: fruit juices: desserts: potato chips and popcorn.","System.Collections.ObjectModel.Collection`1[System.Management.Automation.PSObject]","System.Collections.ObjectModel.Collection`1[System.Management.Automation.PSObject]","System.Collections.ObjectModel.Collection`1[System.Management.Automation.PSObject]","System.Collections.ObjectModel.Collection`1[System.Management.Automation.PSObject]","http://bsm.sfdpw.org/PermitsTracker/reports/report.aspx?title=schedule&report=rptSchedule&params=permit=21MFF-00145&ExportPDF=1&Filename=21MFF-00145_schedule.pdf","","","12/17/2021 12:00:00 AM","20211217","1","11/15/2022 12:00:00 AM","System.Collections.ObjectModel.Collection`1[System.Management.Automation.PSObject]","6","2","9","28853","34","0","Sunday","6AM","12AM","701 HOWARD ST","Southeast Corner of 4th & Howard St, on Howard","Hot dogs, condiments, soft pretzels, soft drinks, coffee, cold beverages, pastries, bakery goods, cookies, ice cream, candy, soups, churros, chestnuts, nuts, fresh fruit, fruit juices, desserts, potato chips and popcorn.","","06:00","23:59","09/06/2011 10:07:44 AM","09/06/2011 10:10:06 AM","N"
"System.Collections.ObjectModel.Collection`1[System.Management.Automation.PSObject]","System.Collections.ObjectModel.Collection`1[System.Management.Automation.PSObject]","Push Cart","System.Collections.ObjectModel.Collection`1[System.Management.Automation.PSObject]","SACRAMENTO ST: FRONT ST to BATTERY ST (300 - 399)","1 THE EMBARCADERO","0230028","System.Collections.ObjectModel.Collection`1[System.Management.Automation.PSObject]","System.Collections.ObjectModel.Collection`1[System.Management.Automation.PSObject]","21MFF-00144","APPROVED","Hot dogs: condiments: soft pretzels: soft drinks: coffee: cold beverages: pastries: bakery goods: cookies: ice cream: candy: soups: churros: chestnuts: nuts: fresh fruit: fruit juices: desserts: potato chips and popcorn.","System.Collections.ObjectModel.Collection`1[System.Management.Automation.PSObject]","System.Collections.ObjectModel.Collection`1[System.Management.Automation.PSObject]","System.Collections.ObjectModel.Collection`1[System.Management.Automation.PSObject]","System.Collections.ObjectModel.Collection`1[System.Management.Automation.PSObject]","http://bsm.sfdpw.org/PermitsTracker/reports/report.aspx?title=schedule&report=rptSchedule&params=permit=21MFF-00144&ExportPDF=1&Filename=21MFF-00144_schedule.pdf","","","12/17/2021 12:00:00 AM","20211217","1","11/15/2022 12:00:00 AM","System.Collections.ObjectModel.Collection`1[System.Management.Automation.PSObject]","3","1","10","28860","6","0","Sunday","6AM","12AM","1 THE EMBARCADERO","Northeast Corner of Sacramento & Battery, on Sacramento. 58' East of the intersection.","Hot dogs, condiments, soft pretzels, soft drinks, coffee, cold beverages, pastries, bakery goods, cookies, ice cream, candy, soups, churros, chestnuts, nuts, fresh fruit, fruit juices, desserts, potato chips and popcorn.","","06:00","23:59","09/06/2011 02:23:02 PM","09/06/2011 02:23:17 PM","N"
"System.Collections.ObjectModel.Collection`1[System.Management.Automation.PSObject]","System.Collections.ObjectModel.Collection`1[System.Management.Automation.PSObject]","Push Cart","System.Collections.ObjectModel.Collection`1[System.Management.Automation.PSObject]","DRUMM ST: CALIFORNIA ST intersection","5 THE EMBARCADERO","0234 017","System.Collections.ObjectModel.Collection`1[System.Management.Automation.PSObject]","System.Collections.ObjectModel.Collection`1[System.Management.Automation.PSObject]","21MFF-00146","APPROVED","Hot dogs: condiments: soft pretzels: soft drinks: coffee: cold beverages: pastries: bakery goods: cookies: ice cream: candy: soups: churros: chestnuts: nuts: fresh fruit: fruit juices: desserts: potato chips and popcorn.","System.Collections.ObjectModel.Collection`1[System.Management.Automation.PSObject]","System.Collections.ObjectModel.Collection`1[System.Management.Automation.PSObject]","System.Collections.ObjectModel.Collection`1[System.Management.Automation.PSObject]","System.Collections.ObjectModel.Collection`1[System.Management.Automation.PSObject]","http://bsm.sfdpw.org/PermitsTracker/reports/report.aspx?title=schedule&report=rptSchedule&params=permit=21MFF-00146&ExportPDF=1&Filename=21MFF-00146_schedule.pdf","","","12/17/2021 12:00:00 AM","20211217","1","11/15/2022 12:00:00 AM","System.Collections.ObjectModel.Collection`1[System.Management.Automation.PSObject]","4","1","10","28855","6","0","Sunday","6AM","12AM","5 THE EMBARCADERO","Northeast Corner of California, Market, and Drumm St","Hot dogs, condiments, soft pretzels, soft drinks, coffee, cold beverages, pastries, bakery goods, cookies, ice cream, candy, soups, churros, chestnuts, nuts, fresh fruit, fruit juices, desserts, potato chips and popcorn.","","06:00","23:59","09/02/2011 02:50:08 PM","09/02/2011 02:50:29 PM","N"
"System.Collections.ObjectModel.Collection`1[System.Management.Automation.PSObject]","System.Collections.ObjectModel.Collection`1[System.Management.Automation.PSObject]","Push Cart","System.Collections.ObjectModel.Collection`1[System.Management.Automation.PSObject]","GEARY ST: GRANT AVE to STOCKTON ST (100 - 199)","100 GEARY ST","0309003","System.Collections.ObjectModel.Collection`1[System.Management.Automation.PSObject]","System.Collections.ObjectModel.Collection`1[System.Management.Automation.PSObject]","22MFF-00039","APPROVED","Hot dogs: condiments: soft pretzels: soft drinks: coffee: cold beverages: pastries: bakery goods: cookies: ice cream: candy: soups: churros: chestnuts: nuts: fresh fruit: fruit juices: desserts: potato chips and popcorn.","System.Collections.ObjectModel.Collection`1[System.Management.Automation.PSObject]","System.Collections.ObjectModel.Collection`1[System.Management.Automation.PSObject]","System.Collections.ObjectModel.Collection`1[System.Management.Automation.PSObject]","System.Collections.ObjectModel.Collection`1[System.Management.Automation.PSObject]","http://bsm.sfdpw.org/PermitsTracker/reports/report.aspx?title=schedule&report=rptSchedule&params=permit=22MFF-00039&ExportPDF=1&Filename=22MFF-00039_schedule.pdf","","","11/03/2022 12:00:00 AM","20221103","1","11/15/2023 12:00:00 AM","System.Collections.ObjectModel.Collection`1[System.Management.Automation.PSObject]","5","1","10","28857","6","0","Sunday","6AM","12AM","100 GEARY ST","Northwest Corner of Grant & Geary St, on Geary","Hot dogs, condiments, soft pretzels, soft drinks, coffee, cold beverages, pastries, bakery goods, cookies, ice cream, candy, soups, churros, chestnuts, nuts, fresh fruit, fruit juices, desserts, potato chips and popcorn.","","06:00","23:59","09/06/2011 10:27:06 AM","09/06/2011 10:27:21 AM","N"
